{
  "apiVersion": "certificateDB/v1",
  "kind": "ReviewGate",
  "scope": "regulatory_change",
  "subject": {
    "path": "jurisdictions/JP/201-230283/record.yaml",
    "sha256": "c6a9f428ba329a85e191f0d8033bf7eb78752cfa9752972fba60f05e5ab8a2bc"
  },
  "evidence": [
    {
      "path": "jurisdictions/JP/201-230283/evidence.yaml",
      "sha256": "91adab74ef2ed30614dcb7247235666cf1e379829747e4aa7c71cb428cde7bd2"
    },
    {
      "path": "documents/JP/201-230283/LOCAL_EVIDENCE.md",
      "sha256": "44c74a17e590bb88366136d0d4e2e86ce1737273474ce821058a96b3bd68ed8e"
    },
    {
      "path": "documents/JP/201-230283/SearchResult (1).csv",
      "sha256": "a1df493125047a57c9738baf7b49ddf1ec7bdb3dddaf00c73605bfd05333ea30"
    }
  ],
  "review": {
    "required": true,
    "reviewer": "nakan",
    "reviewedAt": "2026-09-02T13:32:27+09:00",
    "decision": "accepted",
    "notes": "Self-review confirmed removal of the four test-report PDFs from the repository. Their official source URLs, SHA-256 values, and private-local retention policy remain recorded. The W56 channel observation was re-reviewed against report 201-230283_02_003.pdf and corrected to enumerate the distinct 20 MHz, 40 MHz, and 80 MHz channel sets."
  }
}
