{
  "apiVersion": "certificateDB/v1",
  "kind": "ReviewGate",
  "scope": "verified_promotion",
  "subject": {
    "path": "jurisdictions/JP/201-230283/record.yaml",
    "sha256": "41d105a4fdc22306ee7c384b50c963c1228dbbcbb54f6e29b48ba85ad883a392"
  },
  "evidence": [
    {
      "path": "jurisdictions/JP/201-230283/evidence.yaml",
      "sha256": "bd856de5f7714d86cdd27539ba8c84937679fe42eb1c70344ae0edbf3df3c9fb"
    },
    {
      "path": "documents/JP/201-230283/SearchResult (1).csv",
      "sha256": "a1df493125047a57c9738baf7b49ddf1ec7bdb3dddaf00c73605bfd05333ea30"
    },
    {
      "path": "documents/JP/201-230283/201-230283_01_004.pdf",
      "sha256": "0864bb9284c93530310e68e67fc8722344161a4ab87b9c0078fd216f74383f67"
    },
    {
      "path": "documents/JP/201-230283/201-230283_02_001.pdf",
      "sha256": "748aa89db684068662b6cdd370f0753f3642b7e4cf330b083c259ae14bcc9a83"
    },
    {
      "path": "documents/JP/201-230283/201-230283_02_002.pdf",
      "sha256": "baf492385f88a582be6103a11bd3cd34cf0cd77c6e2142e02aa96cef505119d2"
    },
    {
      "path": "documents/JP/201-230283/201-230283_02_003.pdf",
      "sha256": "fb8a4b0de0bd7d576c0b72c6ed9db389c5315657e41f504e334c7df616ba0ec0"
    }
  ],
  "review": {
    "required": true,
    "reviewer": "nakan",
    "reviewedAt": "2026-08-31T17:25:30+09:00",
    "decision": "accepted",
    "notes": "Self-review promoted this record to reviewed after checking the cited registry CSV, report hashes, reported device identity, and every currently extracted observation against its recorded locator. This evidence-review status is not RF transmission authorization."
  }
}
