{
  "apiVersion": "certificateDB/v1",
  "kind": "ReviewGate",
  "scope": "verified_promotion",
  "subject": {
    "path": "jurisdictions/JP/201-230283/record.yaml",
    "sha256": "c6a9f428ba329a85e191f0d8033bf7eb78752cfa9752972fba60f05e5ab8a2bc"
  },
  "evidence": [
    {
      "path": "jurisdictions/JP/201-230283/evidence.yaml",
      "sha256": "3f2b960b47df55cfc1d5fa25b06b64a253d835132f4e3ef09829cf471ae9c3b9"
    },
    {
      "path": "documents/JP/201-230283/SearchResult (1).csv",
      "sha256": "a1df493125047a57c9738baf7b49ddf1ec7bdb3dddaf00c73605bfd05333ea30"
    },
    {
      "path": "documents/JP/201-230283/LOCAL_EVIDENCE.md",
      "sha256": "44c74a17e590bb88366136d0d4e2e86ce1737273474ce821058a96b3bd68ed8e"
    }
  ],
  "review": {
    "required": true,
    "reviewer": "nakan",
    "reviewedAt": "2026-08-31T19:15:56+09:00",
    "decision": "accepted",
    "notes": "Self-review promoted this evidence record to verified without device disassembly. The scope verifies identity, source integrity, and current extracted safety-relevant observations only. Test-report originals are retained privately and verified by their recorded official URLs and SHA-256 values. Radio/board revision, calibration, board data, runtime configuration, and RF transmission rights remain outside this record and unknown where not evidenced."
  }
}
